PMID	abstract	a_term	b_term	c_term	cot	label
38574433	Objective: Doxorubicin is a potent chemotherapeutic agent for cancer whose use is limited due to its potential cardiotoxicity. Semaglutide (SEMA), a novel analogue of glucagon-like peptide-1 (GLP-1), has received widespread attention for the treatment of diabetes. However, growing evidence highlights the potential therapeutic benefits on cardiac function. Therefore, the purpose of this study was to investigate the efficacy of semaglutide in ameliorating doxorubicin-induced cardiotoxicity. Methods and Results: Doxorubicin-induced cardiotoxicity is an established model to study cardiac function. Cardiac function was studied by transthoracic echocardiography and invasive hemodynamic monitoring. The results showed that semaglutide significantly improved heart dysfunction caused by doxorubicin. RNA sequence analysis suggested that Bnip3 was a candidate gene impairing the protective effect of semaglutide in doxorubicin-induced cardiotoxicity. To determine the role of BNIP3 in the effect of semaglutide on doxorubicin-induced cardiotoxicity, BNIP3 harboring adeno-associated virus serotype 9 (AAV9) expressing the cardiac troponin T (cTnT) promoter was transfected into the tail of C57/BL6J mice. BNIP3 was overexpressed by intravenous injection. Especially in my heart. Overexpression of BNIP3 prevented semaglutide-induced improvement in cardiac function. In vitro experiments showed that through the PI3K/AKT pathway, semaglutide reduced BNIP3 expression in mitochondria, thereby improving mitochondrial function. Conclusions: Semaglutide improves doxorubicin-induced mitochondrial and cardiac dysfunction through the PI3K/AKT pathway by reducing BNIP3 expression in mitochondria. Improvement of mitochondrial function reduces doxorubicin-mediated cardiac damage and improves cardiac function. Therefore, semaglutide is a potential treatment to reduce acute cardiac toxicity induced by doxorubicin. Keywords: BNIP3; doxorubicin-induced cardiotoxicity; mitochondria; PI3K/AKT; Semaglutide.		BNIP3	Semaglutide	The text provided is indeed useful for evaluating the interaction between semaglutide and the BNIP3 gene. It describes a study focusing on the effects of semaglutide, a GLP-1 analog, in improving cardiotoxicity induced by the chemotherapy agent doxorubicin. Key findings include: Evidence of interaction: RNA sequencing identified BNIP3 as a candidate gene that may attenuate the protective effect of semaglutide on doxorubicin-induced cardiotoxicity. This suggests a genetic interaction where BNIP3 expression likely modulates semaglutide efficacy in this context. Experimental validation: Additional experiments involving overexpression of BNIP3 in mice showed that increased levels of BNIP3 prevent semaglutide from improving cardiac function, suggesting that BNIP3 expression is inversely related to the cardioprotective effects of semaglutide. Mechanistic Insights: The text also states that semaglutide, through the PI3K/AKT signaling pathway, reduces BNIP3 expression in mitochondria, which in turn improves mitochondrial function. This decrease in BNIP3 expression is directly related to semaglutide's ability to attenuate mitochondrial and cardiac dysfunction. Therapeutic implications: The finding that semaglutide ameliorates doxorubicin-induced cardiotoxicity via a pathway involving modulation of BNIP3 expression provides valuable insights into both the therapeutic mechanism of semaglutide and the role of BNIP3 in heart health. Overall, the text clearly demonstrates that there is an interaction between semaglutide and the BNIP3 gene, whereby semaglutide modulates BNIP3 expression to exert its therapeutic effects. This interaction is relevant to understanding how semaglutide may be used to potentially mitigate cardiac injury in clinical settings involving doxorubicin therapy. The details of the study presented will be crucial for any further research into the pharmacodynamics of semaglutide and its broader applications in cardiac therapies.	1
35455941	The GBA gene encodes the lysosomal enzyme glucocerebrosidase (GCase), which maintains glycosphingolipid homeostasis. Approximately 5-15% of PD patients have mutations in the GBA gene, which numerically makes it the most important genetic risk factor for Parkinson's disease (PD). Clinically, GBA-related PD is identical to sporadic PD, except that it has an earlier age of onset (AAO), more frequent cognitive impairment, and faster progression. Mutations in GBA can be associated with loss- and gain-of-function mechanisms. A key characteristic of PD is the presence of intraneuronal protein inclusions called Lewy bodies, which are primarily composed of alpha-synuclein. Mutations in the GBA gene can lead to loss of GCase activity and lysosomal dysfunction, which can impair alpha-synuclein metabolism. The GCase deficiency model demonstrates dysfunction of the autophagy-lysosomal pathway and subsequent accumulation of alpha-synuclein. These dysfunctions may also lead to abnormal lipid metabolism, including accumulation of glycosphingolipids, glucosylceramides, and glucosylsphingosines. Certain mutations can cause GCase to become misfolded and retained in the endoplasmic reticulum (ER), activating stress responses, including the unfolded protein response (UPR), contributing to neurodegeneration. In addition to these mechanisms, GCase deficiency has also been linked to mitochondrial dysfunction and neuroinflammation, which are associated with the pathogenesis of PD. In this review, we discuss pathways involved in GBA-PD and highlight potential treatments that target GCase and prevent neurodegeneration.	Parkinson’s Disease	GBA		The text provided is very useful for evaluating whether there is an interaction between Parkinson's disease (PD) and the GBA gene. Here are several reasons that support its benefit: Clear connection between GBA mutations and PD: The text specifies that approximately 5-15% of PD patients have mutations in the GBA gene, making it an important genetic risk factor for Parkinson's disease. This direct association underscores the importance of the GBA gene in the context of Parkinson's disease. Detailed mechanistic insights: The text describes how mutations in the GBA gene can lead to loss of glucocerebrosidase (GCase) activity and subsequent lysosomal dysfunction. This dysfunction is critical because it impairs alpha-synuclein metabolism, a key process in the pathogenesis of Parkinson's disease. Alpha-synuclein is the primary component of Lewy bodies, which are a feature of Parkinson's disease. This provides a mechanistic link between GBA mutations and pathological features observed in PD. Biological consequences of GBA mutations: The review also demonstrates that GBA mutations can lead to loss- and gain-of-function mechanisms. It details how these mutations can cause GCase misfolding and retention in the endoplasmic reticulum, leading to stress responses such as the unfolded protein response (UPR) and possibly contributing to neurodegeneration. This expands on the ways in which GBA mutations can impact cellular health and PD pathology. Association with clinical features of Parkinson's disease: GBA-associated Parkinson's disease is reported to be clinically similar to sporadic Parkinson's disease but with distinct features such as earlier age at onset, more rapid progression, and more frequent cognitive impairment. This differentiation is crucial for understanding the clinical impact of GBA mutations in PD patients. Therapeutic implications: The text highlights potential therapies targeting GCase to prevent neurodegeneration, which not only emphasizes the interaction between GBA and PD but also suggests practical applications of this knowledge in the development of therapeutic strategies.	1
37850885	Background: Psoriasis is a common chronic skin disease. Pathologically, it is characterized by abnormal epidermal hyperplasia, inflammatory cell infiltration, and increased angiogenesis in the dermis. Aberrant expression of E3 ubiquitin ligase and dysregulated protein ubiquitination system are associated with the pathogenesis of psoriasis. Objective: To investigate the potential role of S-phase kinase-related protein 2 (Skp2), an E3 ligase and oncogene, in psoriasis. Methods: Skin samples from patients with psoriasis vulgaris, an imiquimod (IMQ)-induced mouse model, and cultured endothelial cells were analyzed for gene expression and protein by quantitative reverse transcriptase polymerase chain reaction, Western blotting, immunohistochemistry, and immunofluorescence staining. The level was assessed. (EC). Protein interactions, substrate ubiquitination, and degradation were examined in human umbilical vein EC using coimmunoprecipitation, Western blotting, and cycloheximide chase analysis. Angiogenesis was measured in vitro using human dermal microvascular EC (HDMEC) for BrdU incorporation, migration, and tube formation. In vivo angiogenesis assays included chick embryo chorioallantoic membrane, Matrigel plug assays, and quantification of the vasculature of mouse lesions. Skp2 gene-wide knockout (KO) mice and endothelium-specific conditional KO mice were used. Results: Skp2 was increased in skin samples from patients with psoriasis and IMQ-induced mouse lesions. Immunofluorescence double staining indicates a close correlation between Skp2 expression and hypervascularization of the lesional dermal papilla. In HDMEC, Skp2 overexpression enhanced, whereas Skp2 knockdown inhibited EC proliferation, migration, and tubular structure formation. Mechanistically, phosphatase and tensin homolog (PTEN), which inhibits the phosphoinositide 3-kinase/Akt pathway, has been identified as a novel substrate for Skp2-mediated ubiquitination. Selective inhibitors of Skp2 (C1) or Skp2 small interfering RNA significantly reduced vascular endothelial growth factor-induced PTEN ubiquitination and degradation. Additionally, Skp2-mediated ubiquitination is dependent on phosphorylation of PTEN by glycogen synthase kinase 3β. In a mouse model, Skp2 gene deficiency alleviated IMQ-induced psoriasis. Importantly, tamoxifen-induced endothelium-specific Skp2 KO mice showed significant improvement in psoriasis with reduced papillary angiogenesis. Additionally, topical use of the Skp2 inhibitor C1 effectively prevented experimental psoriasis. Conclusions: The Skp2/PTEN axis may play an important role in psoriasis-related angiogenesis. Therefore, targeting Skp2-mediated angiogenesis may be a potential approach for the treatment of psoriasis.	Psoriasis	SKP2		The text provided is very useful for evaluating whether there is an interaction between psoriasis and the SKP2 gene. Here's an argument for its usefulness: Direct investigation of Skp2 in psoriasis: The aims of the study are clearly focused on examining the role of S-phase kinase-associated protein 2 (Skp2), an E3 ubiquitin ligase, in the pathogenesis of psoriasis. Skp2 is being studied in both human and animal models, providing a comprehensive view of its function and effects in the context of this disease. Increased expression in the course of the disease: Results showed that Skp2 expression is increased in skin samples taken from psoriasis patients as well as in the imiquimod (IMQ)-induced psoriasis mouse model. This regulation in disease contexts suggests a potential pathogenic role for Skp2 in psoriasis. Association with psoriasis-associated angiogenesis: Skp2 is associated with hypervascularization in lesional dermal papillae, suggesting a specific role in the angiogenic aspect of psoriasis pathology. The text explains in detail how Skp2 overexpression promotes endothelial cell (EC) proliferation, migration, and tube-like structure formation, which are key components of angiogenesis. Mechanistic Insights Involving Skp2 and PTEN: Study identifies PTEN, a known tumor suppressor and inhibitor of the PI3K/Akt pathway, as a novel substrate for Skp2-mediated ubiquitination. This interaction leads to degradation of PTEN, further implicating Skp2 in the molecular pathways that lead to psoriasis exacerbation, particularly through modulation of angiogenic processes. Therapeutic implications and genetic confirmation: The use of Skp2 inhibitors and gene knockout models (both global and endothelium-specific) show that reducing Skp2 activity or expression can significantly alleviate the symptoms of psoriasis and reduce the angiogenesis associated with the disease. These findings not only support a role for Skp2 in psoriasis but also highlight its potential as a therapeutic target. Extensive experimental approaches: The combination of gene expression analysis, protein interaction studies, and functional testing in cell culture and in vivo, coupled with the use of both pharmacological inhibitors and genetic models, provides a strong body of evidence linking Skp2 to psoriasis pathology. In conclusion, the text is not only useful but also important in providing detailed evidence on the interaction between psoriasis and the SKP2 gene. It elucidates a specific biological pathway involving Skp2 that contributes to disease mechanisms and offers potential targets for therapeutic intervention. The clear demonstration of increased Skp2 activity in psoriatic lesions and its role in promoting pathological angiogenesis via PTEN degradation underscores the importance of Skp2 as a molecular link in psoriasis development.	1
38178103	Background: Some studies have shown that the gut microbiome may be associated with dementia. However, the causal effect between gut microbiota and different types of dementia and whether cytokines act as mediators remain unclear. Methods: Large-scale identification of gut microbiota, cytokines and five types of dementia: Alzheimer's disease (AD), frontotemporal dementia (FTD), Lewy body dementia (DLB), vascular dementia (VD), and Parkinson's disease dementia (PDD). I did. -Summary data from large-scale genome-wide association studies (GWAS). We used Mendelian randomization (MR) to investigate the causal relationship between gut microbiota, cytokines, and five types of dementia. Inverse variance weighting (IVW) was used as the main statistical method. Additionally, we investigated whether cytokines act as mediators in the pathway leading from the gut microbiota to dementia. Results: There were 20 positive and 16 negative causal associations between the genetic liability of gut microbiota and dementia. Additionally, there were five positive causal effects and four negative causal relationships between cytokines and dementia. Cytokines did not act as mediators. Conclusions: Gut microbiota and cytokines were causally related to five types of dementia, and cytokines did not appear to be a mediating factor in the pathway from gut microbiota to dementia. Keywords: Cytokines; idiot; intestinal microflora; Mendelian randomization.	Dementia	IVW		The portion of text provided is not useful for evaluating whether there is an interaction between dementia and the IVW gene. Here are several points explaining why the text does not serve this purpose: Misinterpretation of “IVW”: The text uses the term “IVW” in the context of statistical analysis, and specifically refers to “inverse variance weighting.” IVW is a method used in Mendelian randomization (MR) studies to estimate the causal effect of an exposure on an outcome across multiple genetic instruments. It's not a gene, it's a statistical technique. Focus of the Study: The primary focus of the study is on causal relationships between gut microbiota, cytokines, and various types of dementia, including Alzheimer's disease, frontotemporal dementia, dementia with Lewy bodies, vascular dementia, and Parkinson's disease dementia. The study aims to explore whether cytokines mediate the relationship between gut microbiota and dementia, using genetic data from GWAS and MR. No mention of the IVW gene: There is no discussion or mention of a gene called “IVW” in the context of genetics or molecular biology within the text. Therefore, the text cannot be used to evaluate any interaction involving a gene called “IVW” and dementia because “IVW” in this context refers to a systematic approach, not to a genetic entity. Conclusion imbalance: Because “IVW” refers to a method rather than a gene, the conclusions drawn from using this method (causal relationships between microbiota, cytokines, and types of dementia) do not provide information about gene-specific interactions that affect dementia. In summary, the text is useful for understanding the application of Mendelian randomization in exploring causal links between gut microbiota, cytokines and dementia but does not provide any insight into the interactions between dementia and a gene called “IVW” simply because “IVW” is not a gene but rather a statistical method used in the analysis. Therefore, the transcript cannot be used to evaluate genetic interactions involving a gene with this name in relation to dementia.	0
26242379	Idelalisib is a potent and selective phosphatidylinositol 3-kinase-δ inhibitor, a first-in-class agent approved for the treatment of relapsed chronic lymphocytic leukemia, follicular B cell non-Hodgkin's lymphoma and small lymphoma. In a dose-ranging study, idelalisib exposure increased in a low dose-proportional manner, possibly due to solubility-limited absorption. The approved starting dose of 150 mg twice daily was supported by extensive exposure-response evaluation, with a dose reduction to 100 mg twice daily permitted for specific toxicities. Idelalisib can be administered without regard to dose based on the absence of clinically relevant dose effects, and was dosed accordingly in the primary efficacy/safety studies. Idelalisib is metabolized primarily by aldehyde oxidase (AO) and, to a lesser extent, by cytochrome P450 (CYP) 3A. Co-administration of the strong CYP3A inhibitor ketoconazole 400 mg once daily resulted in a ~79% increase in idelalisib area under the plasma concentration-time curve (AUC). Use of the strong inducer rifampin resulted in a 75% decrease in idelalisib exposure (AUC) and thus, co-administration with strong inducers should be avoided. GS-563117 is an inactive primary circulating metabolite of idelalisib formed primarily by AO. Unlike idelalisib, GS-563117 is a mechanism-based inhibitor of CYP3A. Accordingly, idelalisib 150 mg twice daily increased midazolam AUC by 5.4-fold. Clinically, idelalisib is not an inhibitor of the transporters P-glycoprotein, breast cancer resistance protein, organic anion-transporting polypeptide (OATP) 1B1 or OAPT1B3. In a population pharmacokinetic model, no significant effect on idelalisib pharmacokinetics was observed for any of the covariates tested. Idelalisib exposure was ~60% higher with moderate/severe hepatic impairment. No relevant changes were observed with severe renal impairment. This article reviews a comprehensive pharmacology program, including drug interaction studies and mechanistic and special population studies, that has allowed a thorough understanding of idelalisib clinical pharmacokinetics and their impact on clinical safety and efficacy. .	Breast Cancer		Idelalisib	Understanding the potential application of idelalisib in breast cancer will require data or studies that specifically address its effects on pathogenic mechanisms or treatment outcomes in breast cancer models or patients. Without such information, a definitive assessment of its efficacy against breast cancer cannot be made based on the text provided alone. This text is valuable for understanding the general pharmacological profile of idelalisib but is not sufficient to predict its potential benefits in the treatment of breast cancer.	0
27987518	Episcleritis and scleritis are relatively rare eye diseases, commonly associated with rheumatic diseases including systemic lupus erythematosus (SLE). To investigate the clinical and laboratory features of episcleritis and scleritis associated with SLE, we now report 4 cases of patients with episcleritis or scleritis from September 2005 to July 2016 at the Department of Rheumatology and Immunology, Peking University People's Hospital. Secondary SLE was diagnosed. Demographic, clinical and laboratory characteristics were summarized along with treatment regimen and diagnosis. The literature was reviewed. There were 3 female and 1 male patients. The mean age was (49.0 ± 23.8) years and the mean duration of SLE at the onset of episcleritis or scleritis was (2.1 ± 1.4) years. In addition to ocular involvement, patients may simultaneously present with phlegm symptoms, serositis, lupus nephritis, and interstitial pneumonia; Retrospectively, 1 patient experienced arthritis, 2 presented Raynaud's phenomenon, and 2 had hematologic involvement. All patients had a high titer of antinuclear antibody (ANA). Anti-double-stranded DNA (ds-DNA) antibody titers were elevated in 2 patients. Three patients were positive for anti-nucleosome antibody (ANuA) while the other 1 patient did not test for it. Complement levels were decreased in 3 patients. Systemic lupus erythematosus disease activity index (SLEDAI) scores were greater than 4 points in all patients (range 7–16), suggesting active disease. Eye symptoms included pain, eye redness and tearing. Eye examination revealed 3 cases of episcleritis and 1 case of scleritis. Of the 4 patients, 2 patients experienced ocular complications including loss of vision and uveitis. All patients were treated with systemic corticosteroids in combination with hydroxychloroquine. 3 patients were treated with immunosuppressants (cyclophosphamide in 2 patients and leflunomide in 1 patient). All of the 4 patients received a topical steroid and 1 patient received a periocular injection of triamcinolone acetonide. 1 patient received a topical nonsteroidal anti-inflammatory drug (NSAID). No recurrence of episcleritis or scleritis was observed during follow-ups. As a consequence, scleritis and episcleritis, although uncommon, may occur in patients with autoimmune rheumatic diseases, including SLE. The presence of episcleritis and scleritis may suggest active SLE disease. Patients should be aware of ocular complications. Prompt diagnosis and treatment was associated with good visual outcomes at follow-ups.	Raynaud’s Disease		LEFLUNOMIDE	Although leflunomide is mentioned as part of the treatment regimen for one of the patients, the text does not specifically address its effectiveness or mechanism of action in the context of treating Raynaud's phenomenon. Raynaud's phenomenon has been noted as a condition experienced by some patients in the past, but there is no detailed analysis or discussion of whether leflunomide—or any of the other treatments mentioned—directly targets Eliminating or targeting the key pathogenic mechanisms of Raynaud's. To evaluate whether leflunomide may be effective for Raynaud's, one would look for specific discussions of its effects on vascular function, endothelial health, or other relevant pathophysiological aspects of Raynaud's. Such details will provide insight into whether leflunomide may offer therapeutic benefits or slow disease progression for Raynaud's patients. Finally, while the text is informative regarding the treatment of ocular symptoms in SLE patients and mentions leflunomide as part of the treatment regimen, it is too early to evaluate the efficacy of leflunomide in the treatment of Raynaud's phenomenon. Does not provide sufficient evidence or argument. Further research or articles focusing specifically on Raynaud's and the use of leflunomide in this context would be necessary to evaluate such findings.	0
