PMID	abstract	a_term	b_term	c_term	cot	label
37850885	Background: Psoriasis is a common chronic skin disorder. Pathologically, it features abnormal epidermal proliferation, infiltrating inflammatory cells and increased angiogenesis in the dermis. Aberrant expression of E3 ubiquitin ligase and a dysregulated protein ubiquitination system are implicated in the pathogenesis of psoriasis.  Objectives: To examine the potential role of S-phase kinase-associated protein 2 (Skp2), an E3 ligase and oncogene, in psoriasis.  Methods: Gene expression and protein levels were evaluated with quantitative reverse transcriptase polymerase chain reaction, Western blotting, immunohistochemistry and immunofluorescence staining of skin samples from patients with psoriasis vulgaris and an imiquimod (IMQ)-induced mouse model, as well as from cultured endothelial cells (ECs). Protein interaction, substrate ubiquitination and degradation were examined using co-immunoprecipitation, Western blotting and a cycloheximide chase assay in human umbilical vein ECs. Angiogenesis was measured in vitro using human dermal microvascular ECs (HDMECs) for BrdU incorporation, migration and tube formation. In vivo angiogenesis assays included chick embryonic chorioallantoic membrane, the Matrigel plug assay and quantification of vasculature in the mouse lesions. Skp2 gene global knockout (KO) mice and endothelial-specific conditional KO mice were used.  Results: Skp2 was increased in skin samples from patients with psoriasis and IMQ-induced mouse lesions. Immunofluorescent double staining indicated a close association of Skp2 expression with excessive vascularity in the lesional dermal papillae. In HDMECs, Skp2 overexpression was enhanced, whereas Skp2 knockdown inhibited EC proliferation, migration and tube-like structure formation. Mechanistically, phosphatase and tensin homologue (PTEN), which suppresses the phosphoinositide 3-kinase/Akt pathway, was identified to be a novel substrate for Skp2-mediated ubiquitination. A selective inhibitor of Skp2 (C1) or Skp2 small interfering RNA significantly reduced vascular endothelial growth factor-triggered PTEN ubiquitination and degradation. In addition, Skp2-mediated ubiquitination depended on the phosphorylation of PTEN by glycogen synthase kinase 3β. In the mouse model, Skp2 gene deficiency alleviated IMQ-induced psoriasis. Importantly, tamoxifen-induced endothelial-specific Skp2 KO mice developed significantly ameliorated psoriasis with diminished angiogenesis of papillae. Furthermore, topical use of the Skp2 inhibitor C1 effectively prevented the experimental psoriasis.  Conclusions: The Skp2/PTEN axis may play an important role in psoriasis-associated angiogenesis. Thus, targeting Skp2-driven angiogenesis may be a potential approach to treating psoriasis.	Psoriasis	SKP2		The text provided is highly useful for evaluating whether there exists an interaction between the disease psoriasis and the gene SKP2. Here's an argument supporting its usefulness:  Direct Investigation of Skp2 in Psoriasis: The study's objectives clearly focus on examining the role of S-phase kinase-associated protein 2 (Skp2), an E3 ubiquitin ligase, in the pathogenesis of psoriasis. Skp2 is studied in both human and animal models, providing a comprehensive view of its function and effects in the context of this disease.  Increased Expression in Disease Context: The results show that Skp2 expression is increased in skin samples from patients with psoriasis as well as in an imiquimod (IMQ)-induced mouse model of psoriasis. This upregulation in disease contexts suggests a potential pathogenic role of Skp2 in psoriasis.  Link to Psoriasis-Associated Angiogenesis: Skp2 is associated with excessive vascularity in the lesional dermal papillae, indicating a specific role in the angiogenic aspect of psoriasis pathology. The text details how Skp2 overexpression enhances endothelial cell (EC) proliferation, migration, and tube-like structure formation, which are key components of angiogenesis.  Mechanistic Insights Involving Skp2 and PTEN: The study identifies PTEN, a known tumor suppressor and inhibitor of the PI3K/Akt pathway, as a novel substrate for Skp2-mediated ubiquitination. This interaction leads to the degradation of PTEN, further implicating Skp2 in the molecular pathways that exacerbate psoriasis, particularly through the modulation of angiogenic processes.  Therapeutic Implications and Genetic Confirmation: Use of Skp2 inhibitors and genetic knockout models (both global and endothelial-specific) demonstrate that reducing Skp2 activity or expression can significantly ameliorate psoriasis symptoms and reduce disease-associated angiogenesis. These findings not only support the role of Skp2 in psoriasis but also highlight its potential as a therapeutic target.  Broad Experimental Approaches: The combination of gene expression analysis, protein interaction studies, and functional assays in cell culture and in vivo, along with the use of both pharmacological inhibitors and genetic models, provides a robust set of evidence linking Skp2 with psoriasis pathology.  In conclusion, the text is not only useful but also critical in providing detailed evidence of an interaction between psoriasis and the gene SKP2. It elucidates a specific biological pathway involving Skp2 that contributes to disease mechanisms, offering potential targets for therapeutic intervention. The clear demonstration of increased Skp2 activity in psoriasis lesions and its role in promoting pathological angiogenesis via PTEN degradation underlines the importance of Skp2 as a molecular link in the progression of psoriasis.	1
38178103	Background: Some studies have shown that gut microbiota may be associated with dementia. However, the causal effects between gut microbiota and different types of dementia and whether cytokines act as a mediator remain unclear.  Methods: Gut microbiota, cytokines, and five dementia types, including Alzheimer's disease (AD), frontotemporal dementia (FTD), dementia with Lewy body (DLB), vascular dementia (VD), and Parkinson's disease dementia (PDD) were identified from large-scale genome-wide association studies (GWAS) summary data. We used Mendelian randomization (MR) to investigate the causal relationships between gut microbiota, cytokines, and five types of dementia. Inverse variance weighting (IVW) was used as the main statistical method. In addition, we explored whether cytokines act as a mediating factor in the pathway from gut microbiota to dementia.  Results: There were 20 positive and 16 negative causal effects between genetic liability in the gut microbiota and dementia. Also, there were five positive and four negative causal effects between cytokines and dementias. Cytokines did not act as mediating factors.  Conclusions: Gut microbiota and cytokines were causally associated with five types of dementia, and cytokines seemed not to be the mediating factors in the pathway from gut microbiota to dementia.  Keywords: Cytokines; Dementia; Gut microbiota; Mendelian randomization.	Dementia	IVW		The piece of text provided is not useful for evaluating whether there exists an interaction between the disease dementia and the gene "IVW". Here are several points that clarify why the text does not serve this purpose:  Misinterpretation of "IVW": The text uses the term "IVW" in the context of statistical analysis, specifically referring to "Inverse Variance Weighting". IVW is a method used in Mendelian randomization (MR) studies to estimate the causal effect of an exposure on an outcome across multiple genetic instruments. It is not a gene, but rather a statistical technique.  Focus of the Study: The primary focus of the study is on the causal relationships between gut microbiota, cytokines, and various types of dementia, including Alzheimer's disease, frontotemporal dementia, dementia with Lewy bodies, vascular dementia, and Parkinson’s disease dementia. The study aims to explore if cytokines mediate the relationship between gut microbiota and dementia, using genetic data from GWAS and MR.  No Mention of Gene IVW: There is no discussion or mention of a gene called "IVW" in the context of genetics or molecular biology within the text. Therefore, the text cannot be used to assess any interaction involving a gene named "IVW" and dementia because "IVW" in this context refers to a methodological approach, not a genetic entity.  Conclusion Misalignment: Since "IVW" refers to a method rather than a gene, the conclusions drawn from using this method (causal relationships between microbiota, cytokines, and dementia types) do not provide information about genetic interactions specific to a gene influencing dementia.  In summary, the text is useful for understanding the application of Mendelian randomization in exploring causal links between gut microbiota, cytokines, and dementia but it does not provide any insight into interactions between dementia and a gene called "IVW" simply because "IVW" is not a gene but a statistical method used in the analysis. Thus, the text cannot be used to evaluate genetic interactions involving a gene with that name in relation to dementia.	0
26242379	Idelalisib is a potent, selective phosphatidylinositol 3-kinase-δ inhibitor and the first drug approved for the treatment of relapsed chronic lymphocytic leukemia, follicular B-cell non-Hodgkin lymphoma, and small lymphocytic lymphoma. In dose-ranging studies, idelalisib exposure increased less than in a dose-proportional manner, possibly due to solubility-limited absorption. The approved starting dose of 150 mg twice daily was supported by extensive exposure-response evaluation, with a dose reduction to 100 mg twice daily permitted for certain toxicities. Idelalisib may be administered with or without food based on the lack of clinically relevant food effects and was therefore administered in the primary efficacy/safety study. Idelalisib is metabolized primarily via aldehyde oxidase (AO) and, to a lesser extent, cytochrome P450 (CYP) 3A. Co-administration of 400 mg of ketoconazole, a strong CYP3A inhibitor, once daily resulted in an approximately 79% increase in idelalisib area under the plasma concentration-time curve (AUC). Coadministration with the strong inducer rifampin decreases idelalisib exposure (AUC) by 75% and co-administration with strong inducers should be avoided. GS-563117 is an inactive primary circulating metabolite of idelalisib formed primarily through AO. Unlike idelalisib, GS-563117 is a mechanism-based CYP3A inhibitor. Therefore, when 150 mg of idelalisib is administered twice a day, midazolam AUC increases by 5.4 times. Clinically, idelalisib is not an inhibitor of the transporters P-glycoprotein, breast cancer resistance protein, organic anion transport polypeptide (OATP) 1B1, or OAPT1B3. In the population pharmacokinetic model, no significant effect on idelalisib pharmacokinetics was seen for any covariate tested. Idelalisib exposure was ~60% higher for moderate/severe hepatic impairment. No relevant changes were observed in severe renal impairment. This article reviews our comprehensive pharmacology program, including drug-drug interaction studies, mechanisms, and special population studies. This will provide a thorough understanding of idelalisib clinical pharmacokinetics and its impact on clinical safety and efficacy.	Breast Cancer		Idelalisib	Understanding the potential application of Idelalisib in breast cancer requires data or studies that specifically address its impact on pathogenic mechanisms or therapeutic outcomes in breast cancer models or patients. Without this information, one cannot conclusively evaluate its benefit against breast cancer based on the text provided alone. The text is useful for understanding the general pharmacokinetic profile of Idelalisib but is not sufficient to evaluate its potential benefits in treating breast cancer.	0
27987518	Episcleritis and scleritis are relatively rare eye diseases that are commonly associated with rheumatic diseases, including systemic lupus erythematosus (SLE). To investigate the clinical and laboratory characteristics of SLE-related episcleritis and scleritis, we enrolled 4 hospitalized patients diagnosed with SLE-related episcleritis or scleritis at the Department of Rheumatology and Immunology, People's Hospital of Peking University from September 2005 to July 2016. We report one case. Demographic, clinical, and laboratory characteristics were summarized along with treatment regimens and prognosis. The literature was reviewed. The patients were 3 women and 1 man. The mean age was 49.0 ± 23.8 years, and the mean duration of SLE at onset of episcleritis or scleritis was 2.1 ± 1.4 years. In addition to ocular involvement, the patients suffered concurrent mucocutaneous manifestations, serositis, lupus nephritis, and interstitial pneumonia. In the past, one patient experienced arthritis, two patients showed Raynaud's phenomenon, and two patients had hematological involvement. All patients had high titers of antinuclear antibodies (ANA). Anti-double-stranded DNA (ds-DNA) antibody titers were increased in two patients. Three patients had positive antinucleosomal antibodies (ANuA), and one other patient was not tested for these. Complement levels were decreased in three patients. In all patients (7 to 16 patients), the Systemic Lupus Erythematosus Disease Activity Index (SLEDAI) score was 4 or higher, suggesting active disease. Eye symptoms include pain, redness of the eyes, and watery eyes. Ophthalmological examination revealed 3 cases of episcleritis and 1 case of scleritis. Two of the four patients experienced ocular complications such as decreased vision and uveitis. All patients were treated with systemic corticosteroids combined with hydroxychloroquine. Three patients were treated with immunosuppressants (cyclophosphamide in two patients and leflunomide in one patient). All four patients received topical steroids, and one patient received periocular injections of triamcinolone acetonide. One patient received topical nonsteroidal anti-inflammatory drugs (NSAIDs), and no recurrence of episcleritis or scleritis was observed during follow-up. In conclusion, although uncommon, scleritis and episcleritis may occur in patients with autoimmune rheumatic diseases, including SLE. The development of episcleritis and scleritis may indicate active disease in SLE. Patients should be aware of ocular complications. Prompt diagnosis and treatment were associated with good visual outcome at follow-up.	Raynaud’s Disease		LEFLUNOMIDE	While leflunomide is mentioned as part of a patient's treatment regimen, the text does not delve into its effectiveness or mechanism of action specifically in the context of treating Raynaud's phenomenon. Raynaud's phenomenon has been noted as a condition experienced by some patients in the past, but there is no detailed analysis or discussion of whether leflunomide - or any other treatment mentioned - is directly aimed at alleviating or targeting the major pathogenic mechanisms of Raynaud's disease. To evaluate whether leflunomide is effective in treating Raynaud's, one can look for specific discussions of its effect on vascular function, endothelial health, or other pathophysiological aspects relevant to Raynaud's. Such details will provide insight into whether leflunomide could offer therapeutic benefits or slow disease progression in Raynaud's patients. In conclusion, while the text is informative regarding the treatment of ocular manifestations in patients with SLE and mentions leflunomide as part of the treatment regimen, it does not provide sufficient evidence or discussion to evaluate the effectiveness of leflunomide in the treatment of Raynaud's phenomenon. Further research or texts focusing specifically on Raynaud's disease and the use of leflunomide in this context would be necessary to make such an evaluation.	0
21701167	Background: Prescribed omega-3 acid ethyl ester (PO-3A) has been tested for outcome benefits in patients with coronary artery disease (CAD), arrhythmias, and heart failure. Some evidence suggests that PO-3A may exert its benefits through platelet inhibition. We tested the hypothesis that PO-3A may inhibit platelet activity in patients with documented stable CAD beyond the antiplatelet properties of aspirin and statins. Methods: Thirty patients with CAD and triglycerides ≥250 mg/dl treated with aspirin (70-160 mg/day) and statins (simvastatin equivalent dose: 5-40 mg/day) were randomized 1:1:1 to Omacor™ 1. It has been assigned. g/day (DHA/EPA ratio 1.25:1.0), Omacor 2 g/day, or placebo for 2 weeks. Platelet testing, including agglutination, flow cytometry, and cartridge analyzer readings, was performed at baseline and at weeks 1 and 2 following PO-3A treatment. Results: ADP-induced platelet aggregation (p = 0.037), GP IIb/IIIa antigen (p = 0.031) and activity (p = 0.024), and P-selectin (p = 0.041) were significantly decreased after PO-3A, ​​while platelets were significantly decreased after PO-3A. has decreased significantly. /Endothelial cell adhesion molecule (p = 0.09), vitronectin receptor (p = 0.16), platelet-monocyte microparticle formation (p = 0.19) and verifyNow IIb/IIIa test (p = 0.27) were not significant suggesting thrombocytopenia. It only showed no tendency. activity. Finally, collagen- and arachidonic acid-induced aggregation, closure time using the PFA-100 device, and expression of thrombospondin (CD36), GP Ib (CD42b), LAMP-3 (CD63), LAMP-1 (CD107a), and CD40-ligand. (CD154), GP37 (CD165), and PAR-1 receptor intact (SPAN 12) and truncated (WEDE-15) epitopes were not affected by 2 weeks of PO-3A. Conclusions: Short-term treatment with PO-3A, ​​regardless of dose, already at week 1, provided a small reduction in platelet activity biomarkers despite combined aspirin and statin treatment compared with placebo. The effects of PO-3A are unique and different from other known antiplatelet agents, suggesting potential pleiotropic manifestations. These preliminary randomized data require confirmation in prospective studies.	Heart Disease		OMEGA-3-ACID ETHYL ESTERS	The results indicate that short-term treatment with PO-3A results in a modest reduction in certain markers of platelet activity, suggesting that these omega-3 acid ethyl esters have a unique effect on platelet function beyond the antiplatelet properties of aspirin and statins. The significant reductions observed in ADP-induced platelet aggregation, GP IIb/IIIa antigen and activity, and P-selectin after PO-3A treatment, compared to placebo, highlight a potential mechanism by which PO-3A may provide benefits in the context of disease. my heart. Platelets play a crucial role in the pathogenesis of atherosclerosis and thrombosis, which are fundamental in the development and progression of CAD. By reducing platelet activation and aggregation, PO-3A may help reduce the risk of thrombotic events, such as myocardial infarction, and thus potentially slow the progression of heart disease. The text states that the observed effects call for confirmation in future studies, suggesting that although the results are promising, more research is needed to fully understand the therapeutic potential and implications of PO-3A in heart disease. However, this study contributes valuable evidence to the discussion about the benefits of omega-3 acid ethyl esters in heart disease, especially with regard to their unique antiplatelet properties and their potential role in therapeutic strategies beyond conventional therapies.	1
12676734	This review outlines recent advances related to the molecular mechanisms and pathways of aquaporin-2 (AQP2) waterway trafficking. AQP2 is a fascinating protein that can interpret sorting signals by a variety of cell types to achieve apical or basolateral membrane insertion in both regulatory and constitutive transport pathways. In addition to the well-known cAMP-mediated, stimulatory effect of vasopressin on AQP2 membrane insertion, other signaling and transport events may also cause AQP2 membrane accumulation through cAMP-independent mechanisms. These include 1) elevation of cGMP mediated by sodium nitroprusside (a nitric oxide donor), atrial natriuretic factor, and l-arginine (via nitric oxide synthase); 2) destruction of the actin cytoskeleton; and 3) inhibition of the clathrin-mediated endocytosis portion of the AQP2 recycling pathway by dominant-negative dynamin expression and membrane cholesterol depletion. Recent data also indicate that AQP2 constitutively recycles in epithelial cells and can be inserted into a variety of membrane domains in a variety of cell types both in vitro and in vivo and that these pathways can be regulated by factors including hypertonicity . The role of accessory proteins, including small GTPases and soluble N-ethylmaleimide-sensitive factor attachment protein receptor proteins, in AQP2 membrane insertion is also being revealed. Understanding the cAMP-independent mechanism for membrane insertion of AQP2 is particularly relevant for therapeutic bypass of mutated and dysfunctional vasopressin receptors in patients with X-linked nephrogenic diabetes insipidus.		AQP2	sodium	While sodium nitroprusside is mentioned, it acts as a nitric oxide donor rather than demonstrating sodium interacting directly with AQP2 expression or trafficking. Therefore, the text does not provide evidence or discussion specifically regarding AQP2 expression that directly modulates sodium. To evaluate the original question regarding the interaction of sodium with AQP2 expression, one can look for research that directly investigates the effect of sodium levels on AQP2 expression, trafficking, or function. This could include studies of how sodium concentration affects the cellular localization, stability, or activity of AQP2, none of which are directly addressed in the given text.	0
29520964	The coexistence of type 2 diabetes mellitus (T2DM) and heart failure (HF) with reduced ejection fraction (HFrEF) or preserved ejection fraction (HFpEF) is frequent (30–40% of patients) and carries a higher risk of HF hospitalization. , all-cause and cardiovascular (CV) mortality. The most important causes of HF in T2DM are coronary artery disease, arterial hypertension, and the direct detrimental effects of T2DM on the myocardium. T2DM is often unrecognized in patients with HF and vice versa. This highlights the importance of active screening for both disorders in clinical practice. There are no specific limitations in the treatment of HF in T2DM. A subanalysis of trials addressing HF treatments in the general population found that all HF treatments were similarly effective regardless of T2DM. Regarding the treatment of T2DM in patients with heart failure, most guidelines currently recommend metformin as the first choice. Sulfonylureas and insulin have been traditional second- and third-line treatments, although their safety in heart failure is ambiguous. Neither glucagon-like prepeptide-1 (GLP-1) receptor agonists or dipeptidyl peptidase-4 (DPP4) inhibitors reduce the risk of heart failure hospitalization. In fact, saxagliptin, a DPP4 inhibitor, has been shown to be associated with a higher risk of heart failure hospitalization. Thiazolidinediones (pioglitazone and rosiglitazone) are contraindicated in patients with heart failure (or at risk for heart failure). In a recent trial, the sodium-glucose cotransporter-2 (SGLT2) inhibitors empagliflozin and canagliflozin both significantly reduced heart failure hospitalizations in patients with established cardiovascular disease or at risk for cardiovascular disease. It has been shown to decrease. Several ongoing trials should provide insight into the effectiveness of SGLT2 inhibitors in HFrEF and HFpEF patients without T2DM. Keywords: hypoglycemic agents; heart failure; heart failure hospitalization; heart failure treatment; Type 2 diabetes.		DPP4	metformin	To evaluate whether an interaction exists between metformin and the DPP4 gene, information is needed about pharmacogenetic studies, biochemical interactions, or clinical trials that specifically look at how metformin affects DPP4 gene expression or enzyme function. This information will include detailed discussions of the mechanisms of action of metformin that can affect the DPP4 pathway. In conclusion, while the text is useful for understanding the broader clinical implications of the use of different diabetes treatments in heart failure patients, it does not address the specific query about the interaction between metformin and the DPP4 gene. Therefore, a different source or text that focuses specifically on drug interactions or molecular effects of metformin on DPP4 will be needed.	0
