PMID	abstract	a_term	b_term	c_term	cot	label
21701167	Background: Prescription omega-3-acid ethyl esters (PO-3A) have been evaluated for outcome benefits in patients with coronary artery disease (CAD), arrhythmias, and heart failure. Some evidence suggests that PO-3A may exert its benefit by inhibiting platelets. We tested the hypothesis that PO-3A may inhibit platelet activation in patients with documented stable CAD, independent of the antiplatelet properties of aspirin and statins. Methods: Thirty patients with documented CAD and triglycerides greater than 250 mg/dl treated with aspirin (70-160 mg/day) and statins (simvastatin equivalence dose: 5-40 mg/day) were randomized 1:1:1 to Omacor. ™ Done up to 1. g/day (DHA/EPA ratio 1.25:1.0), Omacor 2 g/day, or placebo for 2 weeks. Platelet tests including aggregometry and flow cytometry and cartridge analyzer readings were performed at baseline and at 1 and 2 weeks after PO-3A therapy. Results: ADP-stimulated platelet aggregation (p = 0.037), GP IIb/IIIa antigen (p = 0.031) and activity (p = 0.024), and P-selectin (p = 0.041) significantly decreased after PO-3A. while platelet/endothelial cell adhesion molecule (p = 0.09), vitronectin receptor (p = 0.16), platelet-monocyte microparticles formation (p = 0.19) and VerifyNow IIb/IIIa test (p = 0.27) showed only non-significant Proposed to reduce Platteland. Activity Finally, collagen- and arachidonic acid-induced accumulation, closure time with the PFA-100 device and thrombospondin (CD36), GP Ib (CD42b), LAMP-3 (CD63), LAMP-1 (CD107a), CD40-ligand (CD154), GP37 (CD165), and PAR-1 receptor intact (SPAN 12) and cleaved (WEDE-15) epitopes were not affected by 2 weeks of PO-3A. Conclusions: Independently of dose and as early as 1 week, short-term therapy with PO-3A provided a modest reduction in platelet activity biomarkers compared to placebo, as well as aspirin and statin therapy. The effect of PO-3A is unique, different from other known antiplatelet agents and suggests possible pleiotropism. These preliminary randomized data call for confirmation in prospective studies.	Heart Disease		OMEGA-3-ACID ETHYL ESTERS	The results indicate that short-term therapy with PO-3A leads to modest reductions in specific markers of platelet activity, suggesting that these omega-3-acid ethyl esters may moderate the antiplatelet properties of aspirin and statins on platelet function. In addition, they have a unique effect. Significant reductions in ADP-stimulated platelet aggregation, GP IIb/IIIa antigen and activity, and P-selectin after PO-3A therapy compared with placebo, highlight a possible mechanism by which PO-3A confers benefits in context. can offer Heart disease. Platelets play an important role in the pathogenesis of atherosclerosis and thrombosis, which are central to the development and progression of CAD. By reducing platelet activation and aggregation, PO-3A may help reduce the risk of thrombotic events, such as myocardial infarction, thereby potentially slowing the progression of heart disease. The text notes that the observed effects call for confirmation in prospective studies, indicating that while the results are promising, the therapeutic potential and implications of PO-3A in cardiovascular disease are not fully understood. More research is needed to understand. Nevertheless, this study provides valuable evidence for the debate on the benefits of omega-3-acid ethyl esters in cardiovascular disease, particularly their unique antiplatelet properties and potential for therapeutic strategies beyond conventional therapies. Regarding character.	1
12676734	This review outlines recent advances in the molecular mechanisms and pathways of aquaporin-2 (AQP2) water channel trafficking. AQP2 is a fascinating protein, whose sorting signals can be perceived by various cell types to achieve apical or basolateral membrane insertion, both in regulated and constitutive trafficking pathways. In addition to the well-known cAMP-mediated, stimulatory effect of vasopressin on AQP2 membrane insertion, other signaling and trafficking events may also lead to AQP2 membrane accumulation through cAMP-independent mechanisms. These include 1) elevation of cGMP, which binds sodium nitroprusside (a nitric oxide donor), atrial natriuretic factor, and L-arginine (via nitric oxide synthase) 2) disruption of the actin cytoskeleton; and 3) inhibition of the clathrin-mediated endocytotic arm of the AQP2 recycling pathway by dominant-negative dynamin expression and membrane cholesterol depletion. Recent data also show that AQP2 partially recycles in epithelial cells, can be inserted into different membrane domains in different cell types both in vitro and in vivo, and that these pathways are involved in hypertonicity, including can be modulated by factors. A role for accessory proteins including small GTPases and soluble N-ethylmaleimide-sensitive element-binding protein receptor proteins in AQP2 membrane insertion is also being uncovered. Understanding the cAMP-independent mechanism for membrane insertion of AQP2 is particularly relevant to the treatment of patients with X-linked nephrogenic diabetes insipidus with a mutated, dysfunctional vasopressin receptor.		AQP2	sodium	While sodium nitroprusside has been mentioned, it acts as a nitric oxide donor rather than directly elucidating the interaction of sodium with AQP2 expression or trafficking. Therefore, the text does not provide evidence or discussion specifically related directly to sodium modulating AQP2 expression. To examine the original question about the interaction of sodium with AQP2 expression, one would conduct studies that would directly investigate the effects of sodium levels on AQP2 expression, trafficking, or function. This may include studying how sodium concentration affects the cellular localization, stability, or activity of AQP2, none of which are directly addressed in the text.	0
29520964	Coexistence of type 2 diabetes mellitus (T2DM) and heart failure (HF), with either reduced (HFrEF) or preserved ejection fraction (HFpEF), is frequent (30–40% of patients) and HF hospitalizations. is associated with a higher risk of , all-cause and cardiovascular (CV) deaths. The most important causes of HF in T2DM are coronary artery disease, arterial hypertension and the direct deleterious effect of T2DM on the myocardium. T2DM is often unrecognized in HF patients, and vice versa, which emphasizes the importance of an active search for both disorders in clinical practice. There are no specific restrictions for HF treatment in T2DM. Sub-analyses of HF treatment trials in the general population have shown that all HF treatments are similarly effective regardless of T2DM. Regarding T2DM treatment in HF patients, most guidelines currently recommend metformin as the first-line choice. Sulfonylurias and insulin have been traditional second- and third-line therapies, although their safety in HF is controversial. Neither glucagon-like peptide-1 (GLP-1) receptor agonists, nor dipeptidyl peptidase-4 (DPP4) inhibitors reduce the risk of HF hospitalization. Indeed, a DPP4 inhibitor, saxagliptin, is associated with a higher risk of HF hospitalization. Thiazolidinediones (pioglitazone and rosiglitazone) are contraindicated in patients with (or at risk of) HF. In recent trials, the sodium-glucose co-transporter-2 (SGLT2) inhibitors, empagliflozin and canagliflozin, have both shown significant reductions in HF hospitalizations in patients with CV disease or at risk for CV disease. Several ongoing trials should provide insight into the effectiveness of SGLT2 inhibitors in patients with HFrEF and HFpEF in the absence of T2DM. Keywords: Glucose-lowering agents Heart failure; hospitalization for heart failure; Treatment of heart failure; Type 2 diabetes mellitus.		DPP4	metformin	To test whether there is an interaction between metformin and the DPP4 gene, information is needed from pharmacogenetic studies, biochemical interactions, or clinical trials that specifically investigate how metformin affects DPP4. Can affect gene expression or enzyme activity. Such information would include a detailed discussion of the mechanism of action of metformin that could potentially affect the DPP4 pathway. Finally, although the text is useful for understanding the broader clinical implications of using various diabetes treatments in heart failure patients, it does not address the specific question of the interaction between metformin and the DPP4 gene. For this, a different source or text focusing specifically on pharmacogenetic interactions or molecular effects of metformin on DPP4 would be required.	0
38574433	Objective: Doxorubicin is a potent chemotherapeutic agent for cancer, whose use is limited by its potential cardiotoxicity. Semaglutide (SEMA), a new analog of glucagon-like peptide-1 (GLP-1), has gained widespread attention for the treatment of diabetes. However, increasing evidence has highlighted its potential therapeutic benefits on cardiac function. Therefore, the aim of this study was to examine the efficacy of semaglutide in reducing doxorubicin-induced cardiotoxicity. Methods and Results: Doxorubicin induced cardiotoxicity is an established model to study cardiac function. Cardiac function was studied by transthoracic echocardiography and invasive hemodynamic monitoring. The results showed that semaglutide significantly improved doxorubicin-induced cardiac dysfunction. RNA sequencing suggested that Bnip3 was the candidate gene that impaired the protective effect of semaglutide in doxorubicin-induced cardiotoxicity. To determine the role of BNIP3 on the effect of semaglutide in doxorubicin-induced cardiotoxicity, BNIP3 was transfected with adeno-associated virus serotype 9 (AAV9) into the tail vein of C57/BLIPJ mice expressing the cardiac troponin T (cTnT) promoter. The injection was done. Especially in the heart. Overexpression of BNIP3 prevented semaglutide-induced improvement in cardiac function. In vitro experiments showed that semaglutide reduced BNIP3 expression in mitochondria through the PI3K/AKT pathway, improving mitochondrial function. Conclusion: Semaglutide ameliorates doxorubicin-induced mitochondrial and cardiac dysfunction by downregulating BNIP3 expression in mitochondria, through the PI3K/AKT pathway. Improvement of mitochondrial function reduces doxorubicin-mediated cardiac injury and improves cardiac function. Therefore, semaglutide is a potential therapy to reduce doxorubicin-induced acute cardiotoxicity. Keywords: BNIP3; doxorubicin-induced cardiotoxicity; Mitochondria; PI3K/AKT; Semaglutide.		BNIP3	Semaglutide	The text provided is actually useful for evaluating the interaction between the drug semaglutide and the gene BNIP3. It describes a study focusing on the effects of semaglutide, a GLP-1 analog, in reducing heart failure induced by the chemotherapeutic agent doxorubicin. Key findings include: Evidence for interaction: RNA sequencing identified BNIP3 as a candidate gene that may mediate the protective effect of semaglutide on doxorubicin-induced cardiotoxicity. This suggests a genetic interaction where BNIP3 expression potentially modulates the effectiveness of semaglutide in this context. Experimental validation: Further experiments involving BNIP3 overexpression in mice showed that increased levels of BNIP3 prevented semaglutide from improving cardiac function, indicating that BNIP3 expression is reversible. related to the cardioprotective effects of semaglutide. Mechanistic insight: The text also reports that semaglutide, through the PI3K/AKT signaling pathway, downregulates BNIP3 expression in mitochondria, resulting in improved mitochondrial function. This decrease in BNIP3 expression is directly linked to semaglutide's ability to reduce mitochondrial and cardiac dysfunction. Therapeutic Implications: The finding that semaglutide ameliorates doxorubicin-induced cardiotoxicity through a pathway involving modulation of BNIP3 expression would provide valuable insight into both the therapeutic mechanism of semaglutide and the role of BNIP3 in the cardia. Is. Overall, the text clearly shows that there is an interaction between semaglutide and the BNIP3 gene, in which semaglutide modulates the expression of BNIP3 to enhance its therapeutic effects. This interaction is relevant to understanding how semaglutide can potentially be used to reduce cardiac injury in clinical settings involving doxorubicin treatment. The study details provided will be important for further research into the pharmacodynamics of semaglutide and its wider use in cardiac therapy.	1
35455941	The GBA gene encodes for the lysosomal enzyme glucocerebrosidase (GCase), which maintains glycosphingolipid homeostasis. About 5-15% of PD patients have mutations in the GBA gene, making it numerically the most important genetic risk factor for Parkinson's disease (PD). Clinically, GBA-associated PD is similar to sporadic PD, except for an earlier age of onset (AAO), more frequent cognitive impairment, and more rapid progression. Mutations in GBA may be associated with loss- and gain-of-function mechanisms. A key hallmark of PD is the presence of intraneuronal proteinaceous inclusions called Lewy bodies, which are composed primarily of alpha-synuclein. Mutations in the GBA gene can lead to loss of GCase activity and lysosomal dysfunction, which can impair alpha-synuclein metabolism. Models of GCase deficiency demonstrate impairment of the autophagic-lysosomal pathway and subsequent accumulation of alpha-synuclein. This dysfunction can also lead to abnormal lipid metabolism, including the accumulation of glycosphingolipids, glucosylceramide and glucosylsphingosine. Some mutations cause GCase to misfold and be retained in the endoplasmic reticulum (ER), activating stress responses including the unfolded protein response (UPR), which may contribute to neurodegeneration. In addition to these mechanisms, a GCase deficiency is also associated with mitochondrial dysfunction and neuroinflammation, which are implicated in the pathogenesis of PD. This review discusses the pathways associated with GBA-PD and highlights potential therapies that may work to target GCase and prevent neurodegeneration.	Parkinson’s Disease	GBA		The text provided is extremely useful for evaluating whether there is an interaction between Parkinson's disease (PD) and the gene GBA. Here are several reasons supporting its usefulness: A clear link between GBA mutations and PD: The text states that about 5-15% of PD patients have mutations in the GBA gene, making it a candidate for Parkinson's disease. Establishes as an important genetic risk factor. This direct association highlights the importance of the GBA gene in the context of PD. Detailed mechanistic insights: The text describes how mutations in the GBA gene can lead to loss of glucorebrosidase (GCase) activity and subsequent lysosomal dysfunction. This dysfunction is critical because it affects alpha-synuclein metabolism, a key process in the pathogenesis of PD. Alpha-synuclein is the main component of Lewy bodies, a hallmark of PD. This provides a mechanistic link between GBA mutations and the pathological features observed in PD. Biological Consequences of GBA Mutations: The Review further explains that GBA mutations can result from both loss and gain mechanisms. It describes how these mutations can cause GCase to misfold and be retained in the endoplasmic reticulum, triggering stress responses such as the unfolded protein response (UPR) and possibly contributing to neurodegeneration. are It expands on the ways in which GBA mutations can affect cellular health and PD pathology. Association with clinical features of PD: It has been noted that GBA-associated PD is clinically similar to sporadic PD but has distinctive features such as earlier age of onset, more rapid progression, and more frequent occurrence. Cognitive impairment. This distinction is important for understanding the clinical implications of GBA mutations in PD patients. Therapeutic Implications: The text highlights potential therapeutics targeting GCase to prevent neurodegeneration, indicating not only the interaction between GBA and PD but also the practical application of this knowledge in developing therapeutic strategies. Also suggests.	1
37850885	Background: Psoriasis is a common chronic skin disorder. Pathologically, it is characterized by abnormal epidermal proliferation, inflammatory cell infiltration and increased angiogenesis in the dermis. Abnormal expression of E3 ubiquitin ligase and a dysregulated protein ubiquitination system are involved in the pathogenesis of psoriasis. Objectives: To examine the potential role of S-phase kinase-associated protein 2 (Skp2), an E3 ligase and oncogene, in psoriasis. Methods: Gene expression and protein levels were examined with quantitative reverse transcriptase polymerase chain reaction, western blotting, immunohistochemistry and immunofluorescence staining in skin samples from psoriasis vulgaris and imiquimod (IMQ)-induced mice. model as well as from endothelial cells. (ECs). Protein interaction, substrate ubiquitination and degradation were examined in human umbilical vein ECs by co-immunoprecipitation, western blotting and cycloheximide chase assay. Angiogenesis was measured in vitro using human dermal microvascular ECs (HDMECs) for BrdU incorporation, migration and tube formation. In vivo angiogenesis assays include quantification of vasculature in chick embryonic chorioallantoic membrane, Matrigel plug assay and mouse lesions. Skp2 gene global knockout (KO) mice and endothelial-specific conditional KO mice were used. Results: Skp2 was increased in skin samples from patients with psoriasis and IMQ-induced mouse lesions. Immunofluorescent double staining indicated a close association of Skp2 expression with excessive vascularity in lesional dermal papillae. In HDMECs, Skp2 overexpression enhanced, while Skp2 knockdown inhibited EC proliferation, migration and formation of tube-like structures. Mechanistically, phosphatase and tensin homolog (PTEN), which suppresses the phosphoinositide 3-kinase/Akt pathway, was identified to be a novel substrate for Skp2-mediated activation. A selective inhibitor of Skp2 (C1) or Skp2 small interfering RNA significantly reduced vascular endothelial growth factor-stimulated PTEN ubiquitination and degradation. In addition, Skp2-mediated ubiquitination is dependent on the phosphorylation of PTEN by glycogen synthase kinase 3β. In a mouse model, Skp2 gene depletion ameliorated IMQ-induced psoriasis. Importantly, tamoxifen-induced endothelial-specific Skp2 KO mice developed significantly improved psoriasis with reduced angiogenesis of papillae. Furthermore, topical application of the Skp2 inhibitor C1 effectively prevented experimental psoriasis. Conclusion: The Skp2/PTEN axis may play an important role in angiogenesis associated with psoriasis. Thus, targeting Skp2-driven angiogenesis may be a potential approach for the treatment of psoriasis.	Psoriasis	SKP2		The text provided is extremely useful for evaluating whether there is an interaction between psoriasis and the SKP2 gene. Here is an argument supporting its utility: Direct Investigation of Skp2 in Psoriasis: Study Objectives To specifically examine the role of S-phase kinase-associated protein 2 (Skp2), an E3 ubiquitin ligase, in the pathogenesis of psoriasis. Focus on. Skp2 is studied in both human and animal models, providing a comprehensive view of its function and effects in the context of this disease. Increased expression in the context of disease: Results showed increased Skp2 expression in skin samples from patients with psoriasis as well as in an imiquimod (IMQ)-induced mouse model of psoriasis. This upregulation in the context of the disease suggests a possible pathogenic role of Skp2 in psoriasis. Link to Psoriasis-Associated Angiogenesis: Skp2 is associated with excessive vascularity in lesional dermal papillae, indicating a specific role in the angiogenic aspect of psoriasis pathology. The text describes how Skp2 overexpression increases endothelial cell (EC) proliferation, migration, and tube-like structure formation, which are key components of angiogenesis. Mechanistic insights involving Skp2 and PTEN: Study identifies PTEN, a known tumor suppressor and inhibitor of the PI3K/Akt pathway, as a novel substrate for Skp2-mediated inhibition. This interaction leads to degradation of PTEN, further implicating Skp2 in molecular pathways that promote psoriasis, particularly through modulation of the angiogenic process. Therapeutic implications and genetic validation: The use of Skp2 inhibitors and genetic knockout models (both global and endothelial-specific) show that reducing Skp2 activity or expression can significantly reduce psoriasis symptoms and prevent disease. May reduce associated angiogenesis. These findings not only support a role for Skp2 in psoriasis but also highlight its potential as a therapeutic target. Comprehensive experimental approach: A combination of gene expression analyses, protein interaction studies, and functional assays in cell culture and in vivo, with the use of both pharmacological inhibitors and genetic models, provides a strong body of evidence linking Skp2 to psoriasis pathology. Provides a set. In conclusion, the text is not only useful but also important in providing detailed evidence of the interaction between psoriasis and the gene SKP2. This defines a specific biological pathway involving Skp2 that contributes to disease mechanisms, offering potential targets for therapeutic intervention. The clear demonstration of increased Skp2 activity in psoriasis lesions and its role in promoting pathological angiogenesis through PTEN degradation underscores the importance of Skp2 as a molecular link in psoriasis progression.	1
38178103	Background: Some studies suggest that gut microbiota may be associated with dementia. However, the causal effects between gut microbiota and different types of dementia and whether cytokines act as mediators remain unclear. Methods: Gut microbiota, cytokines, and five types of dementia, including Alzheimer's disease (AD), frontotemporal dementia (FTD), dementia with Lewy bodies (DLB), vascular dementia (VD), and Parkinson's disease dementia ( PDD) was identified. - Genome-wide association studies (GWAS) summary data at scale. We used Mendelian randomization (MR) to investigate causal relationships between gut microbiota, cytokines and five types of dementia. Inverse variance weighting (IVW) was used as the statistical method. In addition, we explored whether cytokines act as mediating factors in the pathway from gut microbiota to dementia. Results: There were 20 positive and 16 negative causal effects between gut microbiota and genetic susceptibility to dementia. In addition, there were five positive and four negative causal effects between cytokines and dementia. Cytokines did not act as mediating factors. Conclusions: Gut microbiota and cytokines were mainly associated with five types of dementia, and cytokines do not seem to be mediating factors in the pathway from gut microbiota to dementia. Keywords: cytokines dementia gut microbiota; Mendelian randomization.	Dementia	IVW		The text snippet provided is not useful for evaluating whether there is an interaction between the disease dementia and the gene "IVW". Here are several points that illustrate why the text does not serve this purpose: Misinterpretation of "IVW": The text uses the term "IVW" in the context of statistical analysis, specifically "Inverse Variance Weighting." Refers to IVW is a method used in Mendelian randomization (MR) studies to estimate the causal effect of an exposure on an outcome across multiple genetic instruments. It is not a gene, but a statistical technique. Study focus: The study focuses on the causal relationship between gut microbiota, cytokines, and various types of dementia, including Alzheimer's disease, frontotemporal dementia, dementia with Lewy bodies, vascular dementia, and Parkinson's disease dementia. The aim of this study is to explore whether cytokines mediate the relationship between gut microbiota and dementia using genetic data from GWAS and MR. No mention of the gene IVW: There is no discussion or mention of the gene "IVW" in the context of genetics or molecular biology within the text. Therefore, the text cannot be used to infer an interaction between "IVW" and the dementia gene because "IVW" in this context refers to a mechanism, not a genetic entity. Result misalignment: Because “IVW” refers to a method rather than a gene, the results (causal relationships between microbiota, cytokines, and dementia types) using this method may not be relevant to dementia. do not provide information about gene-specific genetic interactions. In summary, this text is useful for understanding the application of Mendelian randomization in finding causal links between gut microbiota, cytokines, and dementia, but it does not provide any insight into the interaction between dementia and the "IVW" gene. is because "IVW". Not a gene but a statistical method used in the analysis. Thus, the text cannot be used to assess genetic interactions involving genes with this name in relation to dementia.	0