PMID	abstract	a_term	b_term	c_term	cot	label
26242379	Idelalisib is a potent and selective phosphatidylinositol 3-kinase-δ inhibitor, which is a first-in-class agent to be approved for the treatment of relapsed chronic lymphocytic leukaemia, follicular B cell non-Hodgkin's lymphoma and small lymphocytic lymphoma. In dose-ranging studies, idelalisib exposure increased in a less than dose-proportional manner, likely because of solubility-limited absorption. The approved starting dose of 150 mg twice daily was supported by extensive exposure-response evaluations, with dose reduction to 100 mg twice daily being allowed for specific toxicities. Idelalisib may be administered without regard to food on the basis of the absence of clinically relevant food effects, and was accordingly dosed in primary efficacy/safety studies. Idelalisib is metabolized primarily via aldehyde oxidase (AO) and, to a lesser extent, via cytochrome P450 (CYP) 3A. Coadministration with the strong CYP3A inhibitor ketoconazole 400 mg once daily resulted in a ~79 % increase in the idelalisib area under the plasma concentration-time curve (AUC). Administration with the potent inducer rifampin resulted in a 75 % decrease in idelalisib exposure (AUC) and, as such, coadministration with strong inducers should be avoided. GS-563117 is an inactive primary circulating metabolite of idelalisib formed mainly via AO. Unlike idelalisib, GS-563117 is a mechanism-based inhibitor of CYP3A. Accordingly, idelalisib 150 mg twice-daily dosing increases the midazolam AUC 5.4-fold. Clinically, idelalisib is not an inhibitor of the transporters P-glycoprotein, breast cancer resistance protein, organic anion-transporting polypeptide (OATP) 1B1 or OAPT1B3. In a population pharmacokinetic model, no meaningful impact on idelalisib pharmacokinetics was noted for any of the covariates tested. Idelalisib exposure was ~60 % higher with moderate/severe hepatic impairment; no relevant changes were observed with severe renal impairment. This article reviews a comprehensive pharmacology programme, including drug-drug interaction studies and mechanistic and special population studies, which has allowed a thorough understanding of idelalisib clinical pharmacokinetics and their impact on clinical safety and efficacy.	Breast Cancer		Idelalisib	Understanding the potential application of Idelalisib in breast cancer would require data or studies that specifically address its impact on the pathogenic mechanisms or therapeutic outcomes in breast cancer models or patients. Without such information, one cannot conclusively evaluate its usefulness against breast cancer based on the provided text alone. The text is valuable for understanding Idelalisib's general pharmacological profile but not sufficient to assess its potential benefits in breast cancer therapy.	0
27987518	Episcleritis and scleritis are relatively rare ocular diseases, which are commonly associated with rheumatic diseases including systemic lupus erythematosus (SLE). To investigate clinical and laboratory features of SLE-associated episcleritis and scleritis, we now report 4 cases of inpatients who were diagnosed with episcleritis or scleritis secondary to SLE from September 2005 to July 2016 in the Department of Rheumatology and Immunology in Peking University People's Hospital. Demographic, clinical and laboratory characteristics were summarized together with the treatment regimen and the prognosis; the literature was reviewed. There were 3 female and 1 male patients. The average age was (49.0±23.8) years and the mean duration of SLE at the onset of episcleritis or scleritis was (2.1±1.4) years. In addition to the eye involvement, the patients had mucocutaneous manifestations, serositis, lupus nephritis and interstitial pneumonia simultaneously; in the past, 1 patient experienced arthritis, 2 presented Raynaud's phenomenon, and 2 had hematologic involvement. All the patients had antinuclear antibody (ANA) of high titer. The anti double-stranded DNA (ds-DNA) antibody titers were increased in 2 patients. Three patients had positive anti-nucleosome antibody (ANuA) while the other 1 patient did not test it. The complement levels were decreased in 3 patients. The systemic lupus erythematosus disease activity index (SLEDAI) scores were more than 4 points in all the patients (ranging from 7-16), suggesting active disease. Ocular symptoms included pain, redness of the eye and tears. Ophthalmic examinations revealed 3 cases of episcleritis and 1 case of scleritis. Among the 4 patients, 2 patients experienced ocular complications including decrease in vision and uveitis. All the patients were treated with systemic corticosteroids combined with hydroxycloroquine; 3 patients were treated with immunosuppressants (cyclophosphamide in 2 patients and leflunomide in 1 patient). All of the 4 patients received topical steroid and 1 patient received periocular injection of triamcinolone acetonide; 1 patient received topical nonsteroidal anti-inflammatory drug (NSAID).No recurrence of episcleritis or scleritis was observed during the follow-ups. As a conclusion, scleritis and episcleritis, although uncommon, may occur in patients with autoimmune rheumatic diseases including SLE. The occurrence of episcleritis and scleritis may suggest active disease of SLE. Ocular complications need to be aware of in the patients. Prompt diagnosis and treatment was associated with good visual outcomes in the follow-ups.	Raynaud’s Disease		LEFLUNOMIDE	While leflunomide is mentioned as part of the treatment regimen for one of the patients, the text does not delve into its effectiveness or mechanism of action specifically in the context of treating Raynaud's phenomenon. Raynaud's phenomenon is noted as a condition experienced by some of the patients in the past, but there is no detailed analysis or discussion on whether leflunomide—or any other treatment mentioned—was directly aimed at alleviating or targeting the key pathogenic mechanisms of Raynaud's.    To evaluate whether leflunomide could be effective for Raynaud's, one would look for specific discussions on its impact on vascular function, endothelial health, or other relevant pathophysiological aspects of Raynaud's. Such details would provide insight into whether leflunomide could offer therapeutic benefits or slow disease progression for Raynaud's patients.    In conclusion, while the text is informative regarding the treatment of ocular manifestations in SLE patients and mentions leflunomide as part of a treatment regimen, it does not offer sufficient evidence or discussion to evaluate leflunomide's efficacy in treating Raynaud's phenomenon. Further research or texts focusing specifically on Raynaud's and the use of leflunomide in that context would be necessary for such an evaluation.	0
21701167	Background: Prescription omega-3-acid ethyl esters (PO-3A) have been tested for outcome benefits in patients with coronary artery disease (CAD), arrhythmias and heart failure. Some evidence suggests that PO-3A may exert their benefit via inhibiting platelets. We tested the hypothesis that PO-3A may inhibit platelet activity in patients with documented stable CAD, beyond the antiplatelet properties of aspirin and statins.  Methods: Thirty patients with documented CAD and triglycerides over 250 mg/dl treated with aspirin (70-160 mg/daily) and statins (simvastatin equivalence dose: 5-40 mg/daily) were randomized 1:1:1 to Omacor™ 1 g/day (DHA/EPA ratio 1.25:1.0), Omacor 2 g/day, or a placebo for 2 weeks. Platelet tests including aggregometry and flow cytometry and cartridge analyzer readings were performed at baseline and at 1 and 2 weeks following PO-3A therapy.  Results: ADP-induced platelet aggregation (p = 0.037), GP IIb/IIIa antigen (p = 0.031) and activity (p = 0.024), and P-selectin (p = 0.041) were significantly reduced after PO-3A, while platelet/endothelial cell adhesion molecule (p = 0.09), vitronectin receptor (p = 0.16), formation of platelet-monocyte microparticles (p = 0.19) and the VerifyNow IIb/IIIa test (p = 0.27) only exhibited nonsignificant trends suggestive of reduced platelet activity. Finally, collagen- and arachidonic acid-induced aggregation, closure time with the PFA-100 device and expression of thrombospondin (CD36), GP Ib (CD42b), LAMP-3 (CD63), LAMP-1 (CD107a), CD40-ligand (CD154), GP37 (CD165), and PAR-1 receptor intact (SPAN 12) and cleaved (WEDE-15) epitopes were not affected by 2 weeks of PO-3A.  Conclusion: Independently of the dose and already at 1 week, short-term therapy with PO-3A provided a modest reduction of platelet activity biomarkers, despite concomitant aspirin and statin therapy, when compared to a placebo. The effect of PO-3A is unique, differs from other known antiplatelet agents and suggests potential pleiotropism. These preliminary randomized data call for confirmation in prospective studies.	Heart Disease		OMEGA-3-ACID ETHYL ESTERS	The results indicate that short-term therapy with PO-3A leads to a modest reduction in certain markers of platelet activity, suggesting that these omega-3-acid ethyl esters have a unique effect on platelet function beyond the antiplatelet properties of aspirin and statins. The significant reductions observed in ADP-induced platelet aggregation, GP IIb/IIIa antigen and activity, and P-selectin after PO-3A therapy, compared to a placebo, highlight a potential mechanism through which PO-3A could offer benefits in the context of heart disease.    Platelets play a critical role in the pathogenesis of atherosclerosis and thrombosis, which are central to the development and progression of CAD. By reducing platelet activation and aggregation, PO-3A might help to lower the risk of thrombotic events, such as myocardial infarction, thereby potentially slowing the progression of heart disease.    The text mentions that the effects observed call for confirmation in prospective studies, indicating that while the findings are promising, further research is needed to fully understand the therapeutic potential and implications of PO-3A in heart disease. Nonetheless, this study contributes valuable evidence to the discussion on the benefits of omega-3-acid ethyl esters in heart disease, especially regarding their unique antiplatelet properties and potential role in therapeutic strategies beyond conventional treatments.	1
12676734	This review outlines recent advances related to the molecular mechanisms and pathways of aquaporin-2 (AQP2) water channel trafficking. AQP2 is a fascinating protein, whose sorting signals can be interpreted by different cell types to achieve apical or basolateral membrane insertion, in both regulated and constitutive trafficking pathways. In addition to the well-known cAMP-mediated, stimulatory effect of vasopressin on AQP2 membrane insertion, other signaling and trafficking events can also lead to AQP2 membrane accumulation via cAMP-independent mechanisms. These include 1) elevation of cGMP, mediated by sodium nitroprusside (a nitric oxide donor), atrial natriuretic factor, and l-arginine (via nitric oxide synthase); 2) disruption of the actin cytoskeleton; and 3) inhibition of the clathrin-mediated endocytotic arm of the AQP2 recycling pathway by dominant-negative dynamin expression and by membrane cholesterol depletion. Recent data also indicate that AQP2 recycles constitutively in epithelial cells, it can be inserted into different membrane domains in different cell types both in vitro and in vivo, and these pathways can be modulated by factors including hypertonicity. The roles of accessory proteins, including small GTPases and soluble N-ethylmaleimide-sensitive factor attachment protein receptor proteins in AQP2 membrane insertion, are also being uncovered. Understanding cAMP-independent mechanisms for membrane insertion of AQP2 is especially relevant to the therapeutic bypassing of the mutated, dysfunctional vasopressin receptor in patients with X-linked nephrogenic diabetes insipidus.		AQP2	sodium	While sodium nitroprusside is mentioned, it serves as a nitric oxide donor rather than directly illustrating an interaction of sodium with AQP2 expression or trafficking. Therefore, the text does not provide evidence or discussion specifically related to sodium modulating AQP2 expression directly.    To evaluate the original question regarding sodium's interaction with AQP2 expression, one would look for research directly investigating the impact of sodium levels on AQP2 expression, trafficking, or function. This could include studies on how sodium concentration affects AQP2's cellular localization, stability, or activity, none of which are directly addressed in the given text.	0
29520964	The coexistence of type 2 diabetes mellitus (T2DM) and heart failure (HF), either with reduced (HFrEF) or preserved ejection fraction (HFpEF), is frequent (30-40% of patients) and associated with a higher risk of HF hospitalization, all-cause and cardiovascular (CV) mortality. The most important causes of HF in T2DM are coronary artery disease, arterial hypertension and a direct detrimental effect of T2DM on the myocardium. T2DM is often unrecognized in HF patients, and vice versa, which emphasizes the importance of an active search for both disorders in the clinical practice. There are no specific limitations to HF treatment in T2DM. Subanalyses of trials addressing HF treatment in the general population have shown that all HF therapies are similarly effective regardless of T2DM. Concerning T2DM treatment in HF patients, most guidelines currently recommend metformin as the first-line choice. Sulphonylureas and insulin have been the traditional second- and third-line therapies although their safety in HF is equivocal. Neither glucagon-like preptide-1 (GLP-1) receptor agonists, nor dipeptidyl peptidase-4 (DPP4) inhibitors reduce the risk for HF hospitalization. Indeed, a DPP4 inhibitor, saxagliptin, has been associated with a higher risk of HF hospitalization. Thiazolidinediones (pioglitazone and rosiglitazone) are contraindicated in patients with (or at risk of) HF. In recent trials, sodium-glucose co-transporter-2 (SGLT2) inhibitors, empagliflozin and canagliflozin, have both shown a significant reduction in HF hospitalization in patients with established CV disease or at risk of CV disease. Several ongoing trials should provide an insight into the effectiveness of SGLT2 inhibitors in patients with HFrEF and HFpEF in the absence of T2DM.  Keywords: Glucose-lowering agents; Heart failure; Heart failure hospitalization; Heart failure treatment; Type 2 diabetes mellitus.		DPP4	metformin	To evaluate whether there exists an interaction between metformin and the gene DPP4, information is needed on pharmacogenetic studies, biochemical interactions, or clinical trials that specifically investigate how metformin might influence DPP4 gene expression or enzyme functionality. Such information would involve detailed discussions on the mechanisms of action of metformin that could potentially impact the DPP4 pathway.  In conclusion, while the text is useful for understanding the broader clinical implications of using various diabetes treatments in heart failure patients, it does not address the specific query about an interaction between metformin and the gene DPP4. For that, a different source or text focusing specifically on pharmacogenetic interactions or the molecular effects of metformin on DPP4 would be required.	0
38574433	Aims: Doxorubicin is a powerful chemotherapeutic agent for cancer, whose use is limited due to its potential cardiotoxicity. Semaglutide (SEMA), a novel analog of glucagon-like peptide-1 (GLP-1), has received widespread attention for the treatment of diabetes. However, increasing evidence has highlighted its potential therapeutic benefits on cardiac function. Therefore, the objective of this study was to examine the efficacy of semaglutide in ameliorating doxorubicin-induced cardiotoxicity.  Methods and results: Doxorubicin-induced cardiotoxicity is an established model to study cardiac function. Cardiac function was studied by transthoracic echocardiography and invasive hemodynamic monitoring. The results showed that semaglutide significantly ameliorated doxorubicin-induced cardiac dysfunction. RNA sequencing suggested that Bnip3 is the candidate gene that impaired the protective effect of semaglutide in doxorubicin-induced cardiotoxicity. To determine the role of BNIP3 on the effect of semaglutide in doxorubicin-induced cardiotoxicity, BNIP3 with adeno-associated virus serotype 9 (AAV9) expressing cardiac troponin T (cTnT) promoter was injected into tail vein of C57/BL6J mice to overexpress BNIP3, specifically in the heart. Overexpression of BNIP3 prevented the improvement in cardiac function caused by semaglutide. In vitro experiments showed that semaglutide, via PI3K/AKT pathway, reduced BNIP3 expression in the mitochondria, improving mitochondrial function.  Conclusion: Semaglutide ameliorates doxorubicin-induced mitochondrial and cardiac dysfunction via PI3K/AKT pathway, by reducing BNIP3 expression in mitochondria. The improvement in mitochondrial function reduces doxorubicin-mediated cardiac injury and improves cardiac function. Therefore, semaglutide is a potential therapy to reduce doxorubicin-induced acute cardiotoxicity.  Keywords: BNIP3; Doxorubicin-induced cardiotoxicity; Mitochondria; PI3K/AKT; Semaglutide.		BNIP3	Semaglutide	The text provided is indeed useful for evaluating the interaction between the drug semaglutide and the gene BNIP3. It describes a study focused on the effects of semaglutide, a GLP-1 analog, in ameliorating cardiotoxicity induced by the chemotherapeutic agent doxorubicin. Key findings include:  Evidence of Interaction: RNA sequencing identified BNIP3 as a candidate gene that may impair the protective effect of semaglutide on doxorubicin-induced cardiotoxicity. This suggests a genetic interaction where BNIP3 expression potentially modifies the effectiveness of semaglutide in this context.  Experimental Verification: Further experiments involving overexpression of BNIP3 in mice showed that increased levels of BNIP3 prevented semaglutide from improving cardiac function, which indicates that BNIP3 expression is inversely related to the cardioprotective effects of semaglutide.  Mechanistic Insights: The text also mentions that semaglutide, through the PI3K/AKT signaling pathway, reduces BNIP3 expression in mitochondria, which in turn improves mitochondrial function. This reduction in BNIP3 expression is directly linked to semaglutide's ability to mitigate mitochondrial and cardiac dysfunction.  Therapeutic Implications: The conclusion that semaglutide ameliorates doxorubicin-induced cardiotoxicity via a pathway that includes modulation of BNIP3 expression offers valuable insights into both the therapeutic mechanism of semaglutide and the role of BNIP3 in cardiac health.  Overall, the text clearly demonstrates that there is an interaction between semaglutide and the BNIP3 gene, with semaglutide modulating the expression of BNIP3 to exert its therapeutic effects. This interaction is relevant for understanding how semaglutide can be used to potentially mitigate cardiac injury in clinical settings involving doxorubicin treatment. The study details provided would be critical for any further research into the pharmacodynamics of semaglutide and its broader applications in cardiac therapeutics.	1
35455941	The GBA gene encodes for the lysosomal enzyme glucocerebrosidase (GCase), which maintains glycosphingolipid homeostasis. Approximately 5-15% of PD patients have mutations in the GBA gene, making it numerically the most important genetic risk factor for Parkinson disease (PD). Clinically, GBA-associated PD is identical to sporadic PD, aside from the earlier age at onset (AAO), more frequent cognitive impairment and more rapid progression. Mutations in GBA can be associated with loss- and gain-of-function mechanisms. A key hallmark of PD is the presence of intraneuronal proteinaceous inclusions named Lewy bodies, which are made up primarily of alpha-synuclein. Mutations in the GBA gene may lead to loss of GCase activity and lysosomal dysfunction, which may impair alpha-synuclein metabolism. Models of GCase deficiency demonstrate dysfunction of the autophagic-lysosomal pathway and subsequent accumulation of alpha-synuclein. This dysfunction can also lead to aberrant lipid metabolism, including the accumulation of glycosphingolipids, glucosylceramide and glucosylsphingosine. Certain mutations cause GCase to be misfolded and retained in the endoplasmic reticulum (ER), activating stress responses including the unfolded protein response (UPR), which may contribute to neurodegeneration. In addition to these mechanisms, a GCase deficiency has also been associated with mitochondrial dysfunction and neuroinflammation, which have been implicated in the pathogenesis of PD. This review discusses the pathways associated with GBA-PD and highlights potential treatments which may act to target GCase and prevent neurodegeneration.	Parkinson’s Disease	GBA		The text provided is highly useful for evaluating whether there exists an interaction between Parkinson's disease (PD) and the gene GBA. Here are several reasons supporting its usefulness:  Clear Connection Between GBA Mutations and PD: The text specifies that approximately 5-15% of PD patients have mutations in the GBA gene, establishing it as a significant genetic risk factor for Parkinson's disease. This direct association underlines the importance of the GBA gene in the context of PD.  Detailed Mechanistic Insights: The text describes how mutations in the GBA gene may lead to loss of glucocerebrosidase (GCase) activity and subsequent lysosomal dysfunction. This dysfunction is crucial as it impairs alpha-synuclein metabolism, a key process in the pathogenesis of PD. Alpha-synuclein is the primary component of Lewy bodies, which are characteristic of PD. This provides a mechanistic link between GBA mutations and the pathological features observed in PD.  Biological Consequences of GBA Mutations: The review further explains that GBA mutations can result in both loss- and gain-of-function mechanisms. It details how these mutations can cause GCase to misfold and be retained in the endoplasmic reticulum, triggering stress responses such as the unfolded protein response (UPR) and potentially contributing to neurodegeneration. This expands on the ways in which GBA mutations can influence cellular health and PD pathology.  Association with Clinical Features of PD: It is mentioned that GBA-associated PD is clinically similar to sporadic PD but with distinct features like an earlier age at onset, more rapid progression, and more frequent cognitive impairment. This differentiation is critical for understanding the clinical impact of GBA mutations in PD patients.  Therapeutic Implications: The text highlights potential treatments targeting GCase to prevent neurodegeneration, which not only underscores the interaction between GBA and PD but also suggests practical applications of this knowledge in developing therapeutic strategies.	1
